{"schema_version":1,"trial":1,"run_id":"todo-cli-20260815T171521Z-b135247d","round":1,"attempt":1,"scope_id":"foundation","at":"2026-08-16T02:15:24.868Z","artifact":"t0/verdicts/r1-a1-t1.json","sha256":"c5674059c7bd6280ae87ff66c62374b700558153742bd27a412bea1477b1dee6","score":{"regressions":0,"fixtures_passed":2,"fixtures_total":2,"db_probe":null},"status":"kept","baseline_trial":null,"delta":"baseline","tree_ref":"refs/shapeup/foundation/kept","digest":[]}
{"schema_version":1,"trial":2,"run_id":"todo-cli-20260815T171521Z-b135247d","round":1,"attempt":1,"scope_id":"add-todo","at":"2026-08-16T02:17:25.979Z","artifact":"t0/verdicts/r1-a1-t2.json","sha256":"3677f5c89c0bf456310ac7d67f1f59b6de971d6171e60ac59a12c0e145959ae6","score":{"regressions":0,"fixtures_passed":1,"fixtures_total":1,"db_probe":null},"status":"kept","baseline_trial":null,"delta":"baseline","tree_ref":"refs/shapeup/add-todo/kept","digest":[]}
{"schema_version":1,"trial":3,"run_id":"todo-cli-20260815T171521Z-b135247d","round":1,"attempt":1,"scope_id":"complete-todo","at":"2026-08-16T02:18:06.175Z","artifact":"t0/verdicts/r1-a1-t3.json","sha256":"0b8635d7dd500bf0d7f16da507b78fb93489a1b608822b367a7c4922e20909d1","score":{"regressions":0,"fixtures_passed":1,"fixtures_total":1,"db_probe":null},"status":"kept","baseline_trial":null,"delta":"baseline","tree_ref":"refs/shapeup/complete-todo/kept","digest":[]}
{"schema_version":1,"trial":4,"run_id":"todo-cli-20260815T171521Z-b135247d","round":1,"attempt":1,"scope_id":"list-todos","at":"2026-08-16T02:18:11.164Z","artifact":"t0/verdicts/r1-a1-t4.json","sha256":"21d4821e80315f2cd3cdeadf7b8959fd15709c71db459919e14d06e755d057f5","score":{"regressions":0,"fixtures_passed":1,"fixtures_total":1,"db_probe":null},"status":"kept","baseline_trial":null,"delta":"baseline","tree_ref":"refs/shapeup/list-todos/kept","digest":[]}
{"schema_version":1,"trial":5,"run_id":"todo-cli-20260815T171521Z-b135247d","round":1,"attempt":1,"scope_id":"remove-todo","at":"2026-08-16T02:18:14.616Z","artifact":"t0/verdicts/r1-a1-t5.json","sha256":"762d76ea08c1719d0cdf8033c5d9fa2bd2c1d165dafc2620db859db40f1d0d70","score":{"regressions":0,"fixtures_passed":1,"fixtures_total":1,"db_probe":null},"status":"kept","baseline_trial":null,"delta":"baseline","tree_ref":"refs/shapeup/remove-todo/kept","digest":[]}
{"schema_version":1,"trial":6,"run_id":"todo-cli-20260815T171521Z-b135247d","round":1,"attempt":1,"scope_id":"cli-integration-test","at":"2026-08-16T02:20:03.486Z","artifact":"t0/verdicts/r1-a1-t6.json","sha256":"2fe1781cf5dc3f7dcd50b99e3a2d87dc5f76f4ed679c2b8ba8a493c22d6b347c","score":{"regressions":0,"fixtures_passed":1,"fixtures_total":1,"db_probe":null},"status":"kept","baseline_trial":null,"delta":"baseline","tree_ref":"refs/shapeup/cli-integration-test/kept","digest":[]}
{"schema_version":1,"trial":7,"run_id":"todo-cli-20260815T171521Z-b135247d","round":2,"attempt":1,"scope_id":"foundation","at":"2026-08-16T02:29:19.788Z","artifact":"t0/verdicts/r2-a1-t1.json","sha256":"811f6925b8467c02eaf9653786547f5e0d0729ae6fec000c46aaaaa7912f3b11","score":{"regressions":0,"fixtures_passed":2,"fixtures_total":2,"db_probe":null},"status":"reverted","baseline_trial":1,"delta":"no change","tree_ref":"refs/shapeup/foundation/kept","digest":[]}
{"schema_version":1,"trial":8,"run_id":"todo-cli-20260815T171521Z-b135247d","round":2,"attempt":1,"scope_id":"list-todos","at":"2026-08-16T02:29:58.764Z","artifact":"t0/verdicts/r2-a1-t2.json","sha256":"b4788663640959063d008da903506e88871c448d32f56bec69ced0be8ea4e4c6","score":{"regressions":0,"fixtures_passed":1,"fixtures_total":1,"db_probe":null},"status":"reverted","baseline_trial":4,"delta":"no change","tree_ref":"refs/shapeup/list-todos/kept","digest":[]}
{"schema_version":1,"trial":9,"run_id":"todo-cli-20260815T171521Z-b135247d","round":2,"attempt":1,"scope_id":"remove-todo","at":"2026-08-16T02:30:02.633Z","artifact":"t0/verdicts/r2-a1-t3.json","sha256":"02c764556e877f837c266e6ed3944eb446e6930261449a4dd548e236060fe922","score":{"regressions":0,"fixtures_passed":1,"fixtures_total":1,"db_probe":null},"status":"reverted","baseline_trial":5,"delta":"no change","tree_ref":"refs/shapeup/remove-todo/kept","digest":[]}
{"schema_version":1,"trial":10,"run_id":"todo-cli-20260815T171521Z-b135247d","round":2,"attempt":1,"scope_id":"complete-todo","at":"2026-08-16T02:30:07.966Z","artifact":"t0/verdicts/r2-a1-t4.json","sha256":"11f582490ca96c62d4535b54f67337355774bd4f5e5047a005075e2a7d7730e8","score":{"regressions":0,"fixtures_passed":1,"fixtures_total":1,"db_probe":null},"status":"reverted","baseline_trial":3,"delta":"no change","tree_ref":"refs/shapeup/complete-todo/kept","digest":[]}
{"schema_version":1,"trial":11,"run_id":"todo-cli-20260815T171521Z-b135247d","round":2,"attempt":1,"scope_id":"add-todo","at":"2026-08-16T02:30:55.232Z","artifact":"t0/verdicts/r2-a1-t5.json","sha256":"60ad0aec2c55b1847dd642fb138a50907b3a33a2347f5194ca81f1c1f7090c03","score":{"regressions":0,"fixtures_passed":1,"fixtures_total":1,"db_probe":null},"status":"reverted","baseline_trial":2,"delta":"no change","tree_ref":"refs/shapeup/add-todo/kept","digest":[]}
{"schema_version":1,"trial":12,"run_id":"todo-cli-20260815T171521Z-b135247d","round":2,"attempt":1,"scope_id":"cli-integration-test","at":"2026-08-16T02:31:24.988Z","artifact":"t0/verdicts/r2-a1-t6.json","sha256":"2d0bc8152dc77fad130d76c648ff1ed9c71a5f68e8509028d2f726e155a946b4","score":{"regressions":0,"fixtures_passed":1,"fixtures_total":1,"db_probe":null},"status":"reverted","baseline_trial":6,"delta":"no change","tree_ref":"refs/shapeup/cli-integration-test/kept","digest":[]}
