{"schema_version":1,"trial":1,"run_id":"todo-cli-20260816T084725Z-ddb6d292","round":1,"attempt":1,"scope_id":"scope-cli-core","at":"2026-08-16T10:22:52.215Z","artifact":"t0/verdicts/r1-a1-t1.json","sha256":"13a6a6dc50c2e6b3637d917c3b98415512bda59fbf9a0c593c3e20370c9191df","score":{"regressions":0,"fixtures_passed":1,"fixtures_total":7,"db_probe":null},"status":"kept","baseline_trial":null,"delta":"baseline","tree_ref":"refs/shapeup/scope-cli-core/kept","digest":[]}
{"schema_version":1,"trial":2,"run_id":"todo-cli-20260816T084725Z-ddb6d292","round":1,"attempt":2,"scope_id":"scope-cli-core","at":"2026-08-16T10:24:34.484Z","artifact":"t0/verdicts/r1-a2-t1.json","sha256":"027a2ecdfa95c48a28bb522f788803ce64f73bbc4893388299f6ac95ebf5dd23","score":{"regressions":0,"fixtures_passed":1,"fixtures_total":7,"db_probe":null},"status":"reverted","baseline_trial":1,"delta":"no change","tree_ref":"refs/shapeup/scope-cli-core/kept","digest":[]}
{"schema_version":1,"trial":3,"run_id":"todo-cli-20260816T084725Z-ddb6d292","round":1,"attempt":3,"scope_id":"scope-cli-core","at":"2026-08-16T10:24:49.048Z","artifact":"t0/verdicts/r1-a3-t1.json","sha256":"a85eafc3ee0ddff2b97b58868d529518211ffbe6c24dae862a8abd03a793fe57","score":{"regressions":0,"fixtures_passed":1,"fixtures_total":7,"db_probe":null},"status":"reverted","baseline_trial":1,"delta":"no change","tree_ref":"refs/shapeup/scope-cli-core/kept","digest":[]}
{"schema_version":1,"trial":4,"run_id":"todo-cli-20260816T084725Z-ddb6d292","round":1,"attempt":1,"scope_id":"scope-integration-test","at":"2026-08-16T10:27:08.315Z","artifact":"t0/verdicts/r1-a1-t2.json","sha256":"8109af2498665fce606e6511cbf2981aebd7fb753c46b3473dbdcc01599266bf","score":{"regressions":0,"fixtures_passed":1,"fixtures_total":1,"db_probe":null},"status":"kept","baseline_trial":null,"delta":"baseline","tree_ref":"refs/shapeup/scope-integration-test/kept","digest":[]}
{"schema_version":1,"trial":5,"run_id":"todo-cli-20260816T084725Z-ddb6d292","round":1,"attempt":5,"scope_id":"scope-cli-core","at":"2026-08-16T10:28:46.328Z","artifact":"t0/verdicts/r1-a5-t1.json","sha256":"2bc5fd62bf9965275ea80024b2cc90b45fe673448e44556644a1905c19f9ea50","score":{"regressions":0,"fixtures_passed":1,"fixtures_total":7,"db_probe":null},"status":"reverted","baseline_trial":1,"delta":"no change","tree_ref":"refs/shapeup/scope-cli-core/kept","digest":[]}
{"schema_version":1,"trial":6,"run_id":"todo-cli-20260816T084725Z-ddb6d292","round":1,"attempt":5,"scope_id":"scope-cli-core","at":"2026-08-16T10:33:02.223Z","artifact":"t0/verdicts/r1-a5-t2.json","sha256":"ac773ad9ede4d2e30cc4f52981b7f610cf39ad82732dd3f9e3d73f24b695933f","score":{"regressions":0,"fixtures_passed":7,"fixtures_total":7,"db_probe":null},"status":"kept","baseline_trial":1,"delta":"+6 fixtures","tree_ref":"refs/shapeup/scope-cli-core/kept","digest":[]}
{"schema_version":1,"trial":7,"run_id":"todo-cli-20260816T084725Z-ddb6d292","round":2,"attempt":1,"scope_id":"scope-cli-core","at":"2026-08-16T10:46:20.152Z","artifact":"t0/verdicts/r2-a1-t1.json","sha256":"212392b645d8ec917ef45d99004932c1f5954693aaa953b96876ba9905cbd71a","score":{"regressions":0,"fixtures_passed":7,"fixtures_total":7,"db_probe":null},"status":"kept","baseline_trial":6,"delta":"no change","tree_ref":"refs/shapeup/scope-cli-core/kept","digest":[]}
{"schema_version":1,"trial":8,"run_id":"todo-cli-20260816T084725Z-ddb6d292","round":2,"attempt":1,"scope_id":"scope-integration-test","at":"2026-08-16T10:47:09.100Z","artifact":"t0/verdicts/r2-a1-t2.json","sha256":"3ff702d46723d4e656f1052f42a7786ae04ff0216d7022e36cf9512b6e3397d4","score":{"regressions":0,"fixtures_passed":1,"fixtures_total":1,"db_probe":null},"status":"kept","baseline_trial":4,"delta":"no change","tree_ref":"refs/shapeup/scope-integration-test/kept","digest":[]}
{"schema_version":1,"trial":9,"run_id":"todo-cli-20260816T084725Z-ddb6d292","round":3,"attempt":1,"scope_id":"scope-cli-core","at":"2026-08-16T11:18:30.966Z","artifact":"t0/verdicts/r3-a1-t1.json","sha256":"50387b00ca9c91fcc631c83abb1c8a28104ac02a9c645c8d302882505231f715","score":{"regressions":0,"fixtures_passed":11,"fixtures_total":11,"db_probe":null},"status":"rebased","baseline_trial":7,"delta":"denominator 7 → 11","tree_ref":"refs/shapeup/scope-cli-core/kept","digest":[]}
{"schema_version":1,"trial":10,"run_id":"todo-cli-20260816T084725Z-ddb6d292","round":3,"attempt":2,"scope_id":"scope-cli-core","at":"2026-08-16T11:19:48.761Z","artifact":"t0/verdicts/r3-a2-t1.json","sha256":"71ac331d04c1e2458c1b213d7613e582f568920f10b6467633d343933fa2d4ba","score":{"regressions":0,"fixtures_passed":11,"fixtures_total":11,"db_probe":null},"status":"kept","baseline_trial":9,"delta":"no change","tree_ref":"refs/shapeup/scope-cli-core/kept","digest":[]}
