{"schema_version":1,"trial":1,"run_id":"todo-cli-20260815T152011Z-1a6a2efb","round":1,"attempt":1,"scope_id":"cli-integration","at":"2026-08-15T16:35:58.992Z","artifact":"t0/verdicts/r1-a1-t1.json","sha256":"967ea82f6346fdf005d6cebc899f83ca3e683ed56ec9825b1131691db166ef32","score":{"regressions":0,"fixtures_passed":0,"fixtures_total":2,"db_probe":null},"status":"kept","baseline_trial":null,"delta":"baseline","tree_ref":"refs/shapeup/cli-integration/kept","digest":[]}
{"schema_version":1,"trial":2,"run_id":"todo-cli-20260815T152011Z-1a6a2efb","round":1,"attempt":2,"scope_id":"cli-integration","at":"2026-08-15T16:36:58.347Z","artifact":"t0/verdicts/r1-a2-t1.json","sha256":"ecf9c71625e3f949270ac776a5b32e20a97b5f186ca890260744939410c82e6e","score":{"regressions":0,"fixtures_passed":0,"fixtures_total":2,"db_probe":null},"status":"reverted","baseline_trial":1,"delta":"no change","tree_ref":"refs/shapeup/cli-integration/kept","digest":[]}
{"schema_version":1,"trial":3,"run_id":"todo-cli-20260815T152011Z-1a6a2efb","round":1,"attempt":3,"scope_id":"cli-integration","at":"2026-08-15T16:37:25.272Z","artifact":"t0/verdicts/r1-a3-t1.json","sha256":"8758eaa6fbbd210be6842736a9735e3350718ff1dafb3ff37e61e584003d996c","score":{"regressions":0,"fixtures_passed":0,"fixtures_total":2,"db_probe":null},"status":"reverted","baseline_trial":1,"delta":"no change","tree_ref":"refs/shapeup/cli-integration/kept","digest":[]}
{"schema_version":1,"trial":4,"run_id":"todo-cli-20260815T152011Z-1a6a2efb","round":1,"attempt":1,"scope_id":"complete-todo","at":"2026-08-15T16:37:44.260Z","artifact":"t0/verdicts/r1-a1-t2.json","sha256":"194f3e5badaa6e4a3ab8878d4c75f4f51ef8288223c54a680f310a2ae80d0a12","score":{"regressions":0,"fixtures_passed":1,"fixtures_total":1,"db_probe":null},"status":"kept","baseline_trial":null,"delta":"baseline","tree_ref":"refs/shapeup/complete-todo/kept","digest":[]}
{"schema_version":1,"trial":5,"run_id":"todo-cli-20260815T152011Z-1a6a2efb","round":1,"attempt":1,"scope_id":"remove-todo","at":"2026-08-15T16:39:12.716Z","artifact":"t0/verdicts/r1-a1-t3.json","sha256":"381dfffb943719c026788c247d92486a046028d79b9d522839a0797ba509cb4e","score":{"regressions":0,"fixtures_passed":1,"fixtures_total":1,"db_probe":null},"status":"kept","baseline_trial":null,"delta":"baseline","tree_ref":"refs/shapeup/remove-todo/kept","digest":[]}
{"schema_version":1,"trial":6,"run_id":"todo-cli-20260815T152011Z-1a6a2efb","round":1,"attempt":1,"scope_id":"list-todos","at":"2026-08-15T16:40:21.480Z","artifact":"t0/verdicts/r1-a1-t4.json","sha256":"49bb4b6595fcabd96e631d5f50f55f6a6286d4df66ec02f71d60b078bd0b7e7b","score":{"regressions":0,"fixtures_passed":1,"fixtures_total":1,"db_probe":null},"status":"kept","baseline_trial":null,"delta":"baseline","tree_ref":"refs/shapeup/list-todos/kept","digest":[]}
{"schema_version":1,"trial":7,"run_id":"todo-cli-20260815T152011Z-1a6a2efb","round":2,"attempt":1,"scope_id":"complete-todo","at":"2026-08-15T16:46:45.205Z","artifact":"t0/verdicts/r2-a1-t1.json","sha256":"599cbd8f8cf698a2d370db1ea2d520247bd468d3362015230f59d89b63ec6176","score":{"regressions":0,"fixtures_passed":1,"fixtures_total":1,"db_probe":null},"status":"reverted","baseline_trial":4,"delta":"no change","tree_ref":"refs/shapeup/complete-todo/kept","digest":[]}
{"schema_version":1,"trial":8,"run_id":"todo-cli-20260815T152011Z-1a6a2efb","round":2,"attempt":1,"scope_id":"foundation","at":"2026-08-15T16:47:27.138Z","artifact":"t0/verdicts/r2-a1-t2.json","sha256":"1f843bed60cb589c21910f81e3a8710742d928748d011495803a6b1cce375534","score":{"regressions":0,"fixtures_passed":2,"fixtures_total":2,"db_probe":null},"status":"kept","baseline_trial":null,"delta":"baseline","tree_ref":"refs/shapeup/foundation/kept","digest":[]}
{"schema_version":1,"trial":9,"run_id":"todo-cli-20260815T152011Z-1a6a2efb","round":2,"attempt":1,"scope_id":"add-todo","at":"2026-08-15T16:47:41.466Z","artifact":"t0/verdicts/r2-a1-t3.json","sha256":"78c3f1bc01124deeca445c5563d15fb01a6552652f77edf7d3bcbbc17c10c765","score":{"regressions":0,"fixtures_passed":1,"fixtures_total":1,"db_probe":null},"status":"kept","baseline_trial":null,"delta":"baseline","tree_ref":"refs/shapeup/add-todo/kept","digest":[]}
{"schema_version":1,"trial":10,"run_id":"todo-cli-20260815T152011Z-1a6a2efb","round":2,"attempt":1,"scope_id":"remove-todo","at":"2026-08-15T16:48:35.795Z","artifact":"t0/verdicts/r2-a1-t4.json","sha256":"2e0a8214fc2a90bff85ebd7b5e3f4853a9169cbf9d72fff3f5f41b1ce52d5e00","score":{"regressions":0,"fixtures_passed":1,"fixtures_total":1,"db_probe":null},"status":"reverted","baseline_trial":5,"delta":"no change","tree_ref":"refs/shapeup/remove-todo/kept","digest":[]}
