{"schema_version":1,"trial":1,"round":1,"attempt":1,"scope_id":"cli-integration","at":"2026-08-15T16:11:27.038Z","artifact":"t0/verdicts/r1-a1-t1.json","sha256":"750c64fa3ad26c11f3dc12065dce94796f7bd3040f18b902d6649355830a6252","score":{"regressions":0,"fixtures_passed":0,"fixtures_total":2,"db_probe":null},"status":"kept","baseline_trial":null,"delta":"baseline","tree_ref":"refs/shapeup/cli-integration/kept","digest":[]}
{"schema_version":1,"trial":2,"round":1,"attempt":1,"scope_id":"foundation","at":"2026-08-15T16:11:44.146Z","artifact":"t0/verdicts/r1-a1-t2.json","sha256":"5fb79fc14d0443985fb69e22aabeeaa8c4d91b9eb3be1584a88e260629965d44","score":{"regressions":0,"fixtures_passed":2,"fixtures_total":2,"db_probe":null},"status":"kept","baseline_trial":null,"delta":"baseline","tree_ref":"refs/shapeup/foundation/kept","digest":[]}
{"schema_version":1,"trial":3,"round":1,"attempt":1,"scope_id":"add-todo","at":"2026-08-15T16:12:23.589Z","artifact":"t0/verdicts/r1-a1-t3.json","sha256":"211cb04e74174cb4852999087ecf184d03ae5f0b17bbd208949d4eff9330cfe9","score":{"regressions":0,"fixtures_passed":1,"fixtures_total":1,"db_probe":null},"status":"kept","baseline_trial":null,"delta":"baseline","tree_ref":"refs/shapeup/add-todo/kept","digest":[]}
{"schema_version":1,"trial":4,"round":1,"attempt":2,"scope_id":"cli-integration","at":"2026-08-15T16:19:50.872Z","artifact":"t0/verdicts/r1-a2-t1.json","sha256":"f7fb97bdf879d6ced693d493a3c5b301b0359a5fb39bb1cff19d3ddc384c67a8","score":{"regressions":0,"fixtures_passed":0,"fixtures_total":2,"db_probe":null},"status":"reverted","baseline_trial":1,"delta":"no change","tree_ref":"refs/shapeup/cli-integration/kept","digest":[]}
{"schema_version":1,"trial":5,"round":1,"attempt":3,"scope_id":"cli-integration","at":"2026-08-15T16:20:10.715Z","artifact":"t0/verdicts/r1-a3-t1.json","sha256":"48c026b8795d1cc25be5731f350f603ceee21fdf4072ac1f023e096da1e0c0a6","score":{"regressions":0,"fixtures_passed":0,"fixtures_total":2,"db_probe":null},"status":"reverted","baseline_trial":1,"delta":"no change","tree_ref":"refs/shapeup/cli-integration/kept","digest":[]}
{"schema_version":1,"trial":6,"round":1,"attempt":1,"scope_id":"remove-todo","at":"2026-08-15T16:21:21.120Z","artifact":"t0/verdicts/r1-a1-t4.json","sha256":"6e615cd3218898b2b2fb2df3ac01644dcccb53264931fbc4abf319ccdcf918f7","score":{"regressions":0,"fixtures_passed":1,"fixtures_total":1,"db_probe":null},"status":"kept","baseline_trial":null,"delta":"baseline","tree_ref":"refs/shapeup/remove-todo/kept","digest":[]}
